transcript_id,video_id,word_count,chars,language,transcript_provider,transcript_model,transcript_version,transcribed_at,sample_group,full_text
67,f5369da15f91dd2d,4905,25837,en,whisper_local,base,v1.0,2026-02-18 04:46:36,random,"We are in Haggai chapter 2 verses 18 through 23. God's Word says this, consider from this day onward, from the 24th day of the ninth month, since the day that the foundation of the Lord's temple was laid consider, is the seed yet in the barn, indeed divine, the fig tree, the pomegranate, and the olive tree have yielded nothing, but from this day on I will bless you, say bless you. The Word of the Lord came a second time to Haggai, from the 24th day of the month. Speak to Zerubabul, governor of Judah, saying, I am about to shake the heavens and the earth, and to overthrow the thrones of kingdoms, I am about to destroy the strength of the kingdoms of the nations, and overthrow the chariots and their riders, and the horses, and their riders shall go down every one by the sword of his brother, on that day declares the Lord of hosts. I will take you, O Zerubabul, my servant, the son of shield, teal, declares the Lord, and make you like a signant ring. For I have chosen you, say chosen you, chosen you, declares the Lord of hosts. This is the Word of the Lord. Amen. That's where I ask the other for the reading of God's Word. Amen. We see it. I have visited and seen with my own eyes the Taj Mahal more times than I can count, and to be honest, I'm over it, which is why it was fascinating to me about a year ago. When a few of our staff went to India together for a vision trip to visit some of our mission partners there to encourage them, when of course they have never seen one of the man-made wonders of the world, and they wanted to see the Taj Mahal, and I get it, I understand, but I was over it. This beautiful structure under the vision and the leadership of Shah Jahan took 22 years to build, over 20,000 workers. His vision was that it would be a place that would inspire awe and imagination, divine beauty. He wanted people when they saw it for the first time to experience paradise of heaven, but on earth. It was meant to evoke wonder. It was so interesting, as I saw the rest of our group going to the Taj Mahal, and they got dressed up. They wanted to look the Indian way, and I just got up wearing my American sweatpants. And I walked, and they were taking photos in every possible angle. I have seen the Taj Mahal at sunset. I have seen it at sunrise. I have seen it at lunch. I've seen it at every hour of the day. When I tell you I'm over it, I am over it. But I was fascinating watching them looking at this for the first time. And I thought to myself, when did I lose the wonder of this place? To a far greater degree, I wonder how many of us walk into the church, and we've lost the sense of awe. We've lost the sense of wonder, the gathering of God's saints, God's people, together being formed together into the likeness of Jesus, stewarding the mysteries of God, but in many ways, we're over it. But I imagine the disciples of Jesus in Matthew chapter 16, when they heard for the first time, that Jesus says that he is building his church, his Echlesia, his called out ones, the gathering of his people, and the gates of hell shall not prevail against it. The power of the Romans, the weight of spiritual religiosity, all the evil of the world cannot withstand what God is building. In the church and I wonder if their minds were filled with wonder, with imagination, of what God can do when those who have confessed the Lordship of Jesus gathered, when those who have been baptized in the life, death, burial, resurrection, ascension, and enthromant of Jesus gathered to exalt Jesus. When we as the Apostle Paul says, the church has been given the mandate to share the manifold wisdom of God to the rulers and the authorities. This is what the Apostle Paul says in Ephesians chapter 3 verse 10, meaning God's plan is that through the church, God's wisdom would be made known. What is God's opinion on every matter? We live in a world right now with so much debate on what's truth and what is not truth, then God has given the church the mandate to extend to the world what God once done in the world. And while we may not be perfect, this is God's plan for us. In fact, if you find a perfect church, you should leave, you'll ruin it. I love what Dr. East and Lee Jones says. He says the church has many critics, but no rivals when it comes to the work of human redemption in the world. About a hundred years ago, a group of destitute, extremely poor women in the village of Mizoram in India became followers of Jesus when they heard the good news of the gospel that they were not their cast. They were not their past. They were not the sum total of what other people said that they were. So moved by the gospel, so moved by the spirit of God in them. They wanted to contribute to the advancement of the church, to the planting of churches, to the supporting of missionaries globally. But what could they do? What could poor women do? Every day, they would take a ration of their rice and they would hold it in their hands. It became a practice known as Baha'i Th"
83,d26746a571467540,4828,25948,en,whisper_local,base,v1.0,2026-02-18 12:21:59,random,"This is Living Truth, the teaching ministry of Calvary Oxnard. Today Pastor Rob Branchflower will be sharing with us insights into God's Word. So let's prepare our hearts and minds as we dive deeper into the living truths of the Holy Bible. All believers have been sent by God to be ambassadors or representatives of Christ. We're not all sent to the same place, but all of us have been sent. In our text today we see the first officially sent missionaries in the Book of Acts. Now previously Philip, Peter and others had certainly done missionary work, but this marked a change where the local church and in this case the church in Antioch became the official missionary sending body. That the local church is the missionary sending organism or body of the church. That God designed missionaries not to send themselves, but to be sent out from the local church. In our text today we're going to gain some principles about how God calls and sends us out as missionaries and how he works in and through us as he does. And the first thing we see in our text this morning is this, God calls. God calls. First one. Now there were in the church at Antioch prophets and teachers, Barnabas, Simeon, who was called Niger, Lucius of Cyrene, Manin, a lifelong friend of Herod the Tetrarch and Saul. While they were worshiping the Lord and fasting, the Holy Spirit said, set apart from me Barnabas and Saul for the work to which I have called them. It's important to understand that God is the initiator of the calling to mission. Now there's a general call to mission to all believers. All of us as believers in Jesus Christ have been given a general commission. We call it the Great Commission. We find it in Matthew chapter 28. All of us are called to go into the world and make disciples baptizing the name of the Father, the Son, and the Holy Spirit and teaching them to obey all that Jesus commanded. That's a command to every single Christ follower. I would even go so far as to say this, there is no such thing as a follower of Christ who isn't called to make disciples and live on mission for him. That's God's general calling for every believer. In addition to the general calling to all believers, God also calls believers to specific missionary callings. This is the case in our text today. We saw in Acts 11 that Saul and Barnabas spent a year in Antioch teaching and making disciples. They were so effective at making disciples in Antioch that it was there that followers of Christ were first called Christians. Think about that. They were so good at making followers of Christ that they started calling them little Christs. As Saul and Barnabas were busy doing the work of ministry and making disciples in Antioch, God called them specifically to be sent out from there as missionaries. They were to take this message of the gospel that they had been discipling the believers in Antioch in. They were to take it on the road or on the seas. Obviously no airplanes back then, so they were traveling by boat and traveling by land. As they were faithfully serving, God gave them a specific calling. As they were specifically serving the general calling of God, God gave them a more specific calling. Verse 2 tells us that while they were worshipping and fasting, the Holy Spirit spoke to them about their calling. And this specific calling was obvious not only to Saul and Barnabas, but to the other leaders of the church as well. God spoke a clear and specific calling for which the church was to ordain them. Notice it wasn't the church or the leaders who called and ordained them. It was God. It's very much like this. God had called Saul and Barnabas to go out and the church said, yes, we agree. This is what the Lord is saying. It's critically important when sending and ordaining people in ministry that the local church, that the leaders believe they're hearing from God. Is God the one who called them? Yes. But are they the only ones who believe that God called them or is that calling evident to others as well, especially the leaders of the church? That's important. If we are God appointed, we are God anointed. That's the good news. The bad news is if we are self-appointed, guess what? We're self-annointed. That's not the anointing I want. I don't want the anointing of Rob because guess what? That's got nothing. That can do nothing. To be self-appointed and self-annointed is a scary place to be. That's why it's important that those who have a specific calling from God, that that calling is witnessed to an effort. We are witnessed to an affirm by the leaders of the church. We do that whenever we raise somebody up, whenever we send somebody out, we would never send somebody out who said, hey, I want to be a missionary and nobody else agreed. That's not a good thing. If you say, hey, I'm called to be a pastor and everybody around you goes, hey, I'm called to go on the mission field and everybody around you goes, hmm, I don't think so. That's a serious warning sign. God is "
31,fca16f0da36b7c27,3529,18451,en,whisper_local,base,v1.0,2026-02-18 03:46:52,random,"Okay, for him and his family. Okay, turn to first Peter, chapter one. All right, well, we already prayed, so we won't have to start with that again. So did you like doing the study? Was it a little bit harder than the one before? No, not too bad. Okay, how about the one before? God provides. A little bit more challenging, a little bit? No, okay, well good. Yes, well this is going to be a very emotional book. I was telling Nicole, I said this is going to be really harder to teach because there's so much talk about persecution and waiting through the persecution. And we don't like to talk about persecution because we don't like persecution. And unfortunately, we're kind of wamps when it comes to persecution because our idea persecution is somebody being mad at us at work, persecution back in Bible days where they were being eaten by lions. It's a little bit of a different situation. So, okay, all right, so coming off of what we started two weeks ago in the introduction, that the theme of this book we talked about, and there's many, many different themes in the book, but they all blend together. We walk through many of them as we did in the intro. So many believers during this time that Peter was talking about the persecution. So many of the believers, Jewish believers, were going back to Judaism. And they were doing this because they were waiting for Jesus to come back. They thought he was going to come back right away. And they were waiting and now it's been so many years and they're just going, you know, I don't know if we want to continue with this. There is so much persecution against Christians. And if they just went back to Judaism, the Romans were tolerating the Jews, but they hated the Christians. So in their mind it was like, well, we are Jews and we did accept Christ, but if we completely went back to Judaism, it'd be safer for us and safer for our children. They just wanted to go back to the way they were raised. And some of the Jews who had accepted Jesus as their Messiah were being persecuted and their faith was being tested daily. So Peter in this book is telling these scattered believers because they had been scattered everywhere. To find joy and strength and to find their security in Christ and to have that eternal future focus. Now I've shared with you before that when Pastor Jeff went to be with the Lord that the only thing that kept me sane during that time of missing him was that oxymoron sort of world I lived in where death is the worst thing you can go through. But it's also the best thing you can go through because, and you know what oxymoron means, it's the same event that brings different emotions. And I would think this is not how I wanted to live my life, but Jeff is living his best life. And I know for a fact he doesn't want to come back to this life, even though I wanted to come back. I would have loved that, but I don't know. And I've talked to so many widows and I go, do you really want your husbands to come back? And I go kind of and it's like, you know, they don't want to. They don't want to hear that. Because every widow wants to hear the year husband wants to come back and be with you. But really the truth is they don't. But these are scattered believers. And they were everywhere. And Peter is, you can see all the names of the places that he talks about in chapter 1, verse 1. And he's calling them to come back and to endure suffering for the sake of Christ. This call is also for us today. This is not just for back then. This is for us today because we have a different type of persecution. But the horrific things that went on in Rome during that time were unbelievable. You got to remember Rome ruled the entire world. Caesar was God. The Christians were told you must reverence Caesar as God and they just wouldn't do it. Persecution was increasing, so was their faith. Rome was a cruel taskmaster. If any of you seen any movies about Rome, Gladiator was one of them, where you can see what they would do. They did those not just to the Gladiators, but they did horrible things to the Christians. Again, Rome would tolerate Jews, but they would not tolerate Christians. Christians were hated and the hatred was growing every single year after Jesus died. There was so much hatred toward the Christians. The Romans believed that the Christians were dangerous. They made everything so much worse than it was. Sounds like Democrats today. They were called irrational. They were considered a cult. Christianity. Christians, like I said, they refused to worship the Roman gods. This was treason or sedition. They were in big trouble for not bending their knee to the Roman gods. Anything that happened in Rome, or they didn't know who started the fires or what went on, they blame the Christians. Plagues, disasters. Anything that happened in a day, they blame the Jews. They told the entire community that Christians were cannibals. They turned communion into something very ugly and something that was li"
97,11db919e2cdbfdc6,3751,19841,en,whisper_local,base,v1.0,2026-02-18 12:49:02,random,"You just said like it is. You said like it is. You said like it is. You said like it is. Today on SoundTruth with Pastor Malcolm Wilde, Calvary Chapel, Mayor at Island. As he sees all of this from a different perspective and it's heartbreaking to him, heartbreaking that not just that the people are surrounded by the Assyrians under siege, but the fact that they don't seem to be going about the whole thing the right way. Instead of being repented, they are partying and looking at them on their rooftops. Nations will rise and fall in the end times. It's prophesied in the Bible, which means that it will come to pass. You can see the scene play out in the world today as it lines up more and more for these events to take place. The important thing to know going into the end times is that you don't have anything to fear if your trust is in Jesus for salvation. Today, Pastor Malcolm is going to share how not everyone in those days will repent and turn to Christ, but there's hope for you in Christ, so you have nothing to fear. Well, let's join Pastor Malcolm in the book of Isaiah 20 with today's edition of SoundTruth. Let's turn to Isaiah 20. In the year that Tartan came to Ashtard when Sagan was the king of Assyria, the king of Assyria sent him and he fought against Ashtard and took it. We've been talking about Assyria quite a lot, the Assyrians, and if you're wondering, where the geographical place of Assyria would be today? Well, it would span actually Syria, the area of Turkey, Iran and Iraq. That would be the place of the Assyrians. That does not mean to say that Syria, Turkey, Iran and Iraq and that you should call those people Assyrians today. They are long gone. When he says Tartan here, this is the title of a commandering chief under Sagan. And Ashtard of course is on the coast of Israel and it was a strong city of the Philistines. At that time the Lord spoke by Isaiah the son of Amos saying, go and remove the sackcloth from your body, take your sandals off your feet, and he did so walking naked and barefoot. Now of course the prophets wore, prophets like Isaiah wore these skins, the camel skins, and with the bristle inside and usually wore a tunic underneath that. I remember when David was dancing before the Lord when they were bringing the Ark of the Covenant back to Jerusalem, where his wife, Mikhail, sort of insulted him because he was uncovering himself in front of the Maidens, and not that David was naked or stark naked. But he had the common tunic. There are a lot of people believe that's what Isaiah had on, that he wasn't stark naked. But he had on a undergarment and he took off the regular garment, walked around like that. But it says naked. So deal with it. It is what it is. The Lord said just as my servant, Isaiah's walk, naked and barefoot three years for a sign in a wonder against Egypt and Ethiopia, so shall the King of Assyria lead away the Egyptian as prisoners and the Ethiopians as captives, young and old, naked and barefoot with their buttocks uncovered to the shame of Egypt. So Isaiah then really walking around this way is sort of a walking illustration and a powerful one too, I guess. The point being that the tragic news is that the Assyrians will lead them away captive in such an awful way. Then they shall be afraid and ashamed of Ethiopia, their expectation and Egypt, their glory. And the inhabitants of this territory will say in that day, surely, such is our expectation wherever we flee for help to be delivered from the King of Assyria and how shall we escape. When we come to chapter 21 of Isaiah, we come now to speak of the destruction that will come upon Babylon, Adam, Arabia, that will actually come from the Meadow Persian Empire. But that will not take place for another 200 years from this prophecy when Babylon falls to the Meads. Later on in the 45th chapter, we have more detail about this prophecy and about this fall of Babylon. Intracure prophecy, even naming the Meadow Persian general who will conquer Babylon, a couple hundred years before it actually happened. Cyrus is named there in chapter 45. We'll talk more about that when we get there, when we get to that chapter, but it's sort of fascinating to think of this man being named. Daniel actually telling them, hey, did you know you were named? So, verse 1, the burden against the wilderness of the sea as well wins in the South pass through, so it comes from the desert from a terrible land. The Babylon, because it's known as the desert of the sea, an area where the Tigris and Euphrates come together. A distressing vision is declared to me. The treacherous dealer deals treacherously and the plunderer plunders. Go up, O'ealum, besiege, O'media. All its sightings have made to cease. Euphrates was the name used then because Persia wasn't the name that was even used, but that is who was talking off here along with the Meads. And Persians are not even prominent yet. Therefore, my loyons are filled with pain, pangs have taken hold of"
45,90b329c66e2d13ea,6877,36610,en,whisper_local,base,v1.0,2026-02-18 04:13:24,random,"of the globalization of the news media, you know, we have opportunities to hear about small things that are happening in other countries, right? And in some cases, big things that are happening in other countries that the news media didn't cover, like what's happening in Iran right now. We can pray for our brothers and sisters in Iran. But all that to say, one of the things that's humorous to me as we hear the news from other countries is how human nature is eerily the same from nation to nation, regardless of cultural differences. So take, for instance, a New Zealand man named Ivan Segaden, right now Ivan, I don't know if he moved in from Russia or whatever, but that was his name, he was in New Zealand. And Ivan didn't like wearing a seatbelt. Now I'm not gonna ask for a show of hands, but I would imagine some of you kind of may fall into that category and you're like, not gonna wear it this time, no matter how much my car screams at me. And so New Zealand, like Alabama, is a click it or ticket kind of place, right? And so over a period of five years, the police gave Ivan 32 tickets for not buckling up. But the tickets didn't work. Ivan refused to buckle up. And finally, Ivan actually got the idea that he thought was smart. His problem was in his mind, I'm spending all this money on tickets. It's really affecting my Starbucks budget and my date night budget, I guess, maybe I don't know if that's what he's thinking. And so what should the solution be? Now if you're thinking to yourself, it sounds like Ivan should wear a seatbelt. Then friend, you are too common-sensical for Ivan. Ivan developed an idea where he would have, and this isn't actually Ivan or his necessarily his idea, this is actually a shirt that foolish people, I'll temper my language, that foolish people would wear, instead of wearing their seatbelt, Ivan just came up with one of these deals that when he got in, he made a fake seatbelt strap, he just kind of throw over his body, and so he quit getting tickets. Now the problem was that it didn't really affect Ivan's driving and his trick worked for a while. He didn't have to pay any more tickets, but that doesn't mean it didn't cost him anything. In fact, tragically, Ivan paid with his life in a head-on collision with a tree, where that fake seatbelt did not prevent him from being thrown forward into the steering column and that the actual seatbelt would have stopped. And so discussing the accident, the coroner described the fake seatbelt. He said, though his car was fitted with seatbelts, an extra belt with a long strap had been knotted above the seatbelt on the driver's side, providing a belt to simply sit over his shoulder. Now while there are a number of lessons that we could learn from Ivan today, here's one that you may not be thinking of, when truly tested in this life, what is fake will fail. When truly tested in this life, what is fake will fail you. Or maybe to put it another way is that truth matters. Truth matters. You will ultimately be held accountable for how you live and for what you believe, how you live and what you believe. Accountability for how you live and what you believe, in fact is woven into creation and you could just add to that by the creator. So over the past few weeks, we have had the opportunity to hear the most important message ever declared from four different witnesses. The good news about Jesus Christ describes what's most important to God concerning our redemption. And then his initiative to restore us to his purposes. And last Sunday, in the book of Acts, we saw the incredible power of the Holy Spirit unleashed into the early church, thus continuing the ministry of Jesus and fulfilling the great commission to take the gospel to Jerusalem, to Judea, and to Alsemaria, and to the ends of the earth. And what we see now being played out in the rest of the New Testament is that where the news about Jesus is embraced, where the news about Jesus is embraced, real life as God intended is restored. But where this news about Jesus is rejected, brokenness continues. Let me say that again, because that's really the starting point for the rest of the New Testament, where the news about Jesus and those four gospel accounts, where that news is embraced real life as God intended is restored. But where this news is rejected, where this news is rejected, then life continues to be broken. The gospel is a fork in the road that has eternal consequences. That's why the New Testament authors go from simply describing the gospel, because you think, I mean, if that's the most important message, then why not just have the book of Acts that talks about how the church started and then maybe revelation and how everything ends and then what's the purpose of the middle? It's because they went from describing the gospel to defending the gospel because of this truth, because what you believe matters, you can sincerely believe lies and it still destroy your life, right? But if you believe "
