transcript_id,video_id,word_count,chars,language,transcript_provider,transcript_model,transcript_version,transcribed_at,sample_group,full_text
88,68b4f06919a992b0,12040,61444,en,whisper_local,base,v1.0,2026-02-18 12:31:21,longest,"All right, we're going to take Daniel chapter one today and we did an overview last time, kind of an introduction to the book and the structure and the outline and the three different sieges in Jerusalem and what Nebuchadnezzar was trying to accomplish and what really the Lord was using Nebuchadnezzar four as his instrument of judgment upon Israel and these three sieges. And so we'll dive into the book today in chapter one where Daniel and his three friends are taken captive and drug off to Babylon in this first siege. So there's a there are a lot of great lessons here in Daniel one about just simply refusing the world and I just want you to get the picture of Daniel as this young Jewish man who has grown up in Israel but is captive by a foreign enemy drug off to a land that he's never been to they speak a language he doesn't know they're eating food that he's not familiar with he's captive in this prison and he has every reason to accept what the king is trying to give him and he denies it because it goes against what God wants him to do and so we're going to learn a lot about this or through this event and I hope it's encouraging to you on refusing what the enemy would ask would offer you out of this world in our lives today because it's very applicable so let's pray Father I thank you so much for this time together and God I just pray that you would bless our study in your word this morning as we go through Daniel chapter one. God I thank you for preserving this book for us Lord as you told Daniel in chapter 12 to seal up the book until the time of the end and Father we're here we've we have made it to this point we're all the way thousands of years in the future in 2026 and Lord this book is every bit as applicable and exciting to study today as it was when you wrote it through Daniel all those centuries ago and so Father I just pray that these lessons would not be wasted on us that God you would use them to build up our most holy faith on your word Lord because of Romans 10 17 faith comes by hearing and hearing by the word of God and Lord we need to build up our faith on your word today more than ever to stand against what the enemy is trying to push into this earth at this time and Father I just pray that you'd use this this book of prophecy to teach us to give us eyes to see and ears to hear what your spirit is doing in this world today and Father we thank you for it and your precious name we pray Jesus amen amen okay so we've got to we've got to lean on the Holy Spirit so that out of first on 227 28 if you have the Holy Spirit the annoying that that abides in you teach you everything out of the word of God then we may have confidence and not be ashamed before him at his coming as it says in verse 28 so the way you have confidence and to stand unashamed before Christ is to build your life on the word of God and only the word of God there is there is no faith in anything else and if you'll just listen to what God says not what other people say says and not what you hope he says because it fits some narrative you've built in your head then then you will be a refined vessel fit for service that will not be ashamed when Christ calls us home in the rapture or when you take your last breath whichever comes first and that's actually a part of the mission statement that the Lord wrote for this church is to foster strengthen and grow an unashamed bride for Jesus' return and the only way to do that is to get the word of God back into the body of Christ so that we are on the meat of the word growing according to what God wants us to have in a study and not anything else if there's anything in my lifetime for sure that the church has been lacking in almost every church I've been a part of my whole life it's simply just studying the Bible and it's really heartbreaking because it's the one thing and the one most important thing that we should build our lives on as Christians because in the beginning was the word and Jesus is the word the word became flesh and tabernacle amongst us according to John 114 so we should be studying it and how often according to act 1711 we should be studying it daily so it's a daily routine you've got to wash your mind with the regenerative water of the word daily and take it in daily and build up your life so that you can stand against whatever this world is throwing at you and you see things I mean just think about where we were six years ago this month kind of hearing about something going on in China with some coronavirus and and then all of a sudden the world got shut down in March of 2020 and a lot of Christians around the world I'm not saying any way specifically here in Oklahoma City but just a lot of Christians around the world fear and panic took over their life and it should have never done that if you if you would have been in the Bible studying the Bible and building up your faith then you can stand when the enemy throws things like that at us in the world at the church so"
14,dc0a2c1b1c0665bb,10888,56158,en,whisper_local,base,v1.0,2026-02-18 03:12:49,longest,"Hey thanks for checking out the teaching from Calvary Chapel Chad and Nuga. To learn more about us you could go to our website CalvaryChat.com or you could take us wherever you go by downloading our free app. There you'll find teachings, how to get involved in what God is doing here, and you can even support the work that He is doing through Secure Online Give Me. In the meantime, grab your Bible and enjoy the teaching. Good morning. My name is Jesse. I serve on the Family Ministry team here at Calvary Chapel Chad and Nuga. It's a privilege to be able to be here with you this weekend and teach God's Word. I've got a quick question, a little icebreaker. How many of you guys have already started to take down your Christmas stuff? How many of you guys have you started but you still have stuff up? Yeah, if you're liking me you're like, I'm not taking everything down, that was a lot of work. I'm going to milk this for one more week at least. How many of you have taken everything down? It's all gone. All right, hold on, keep your hands up, keep your hands up. All right, everybody look at these people. These people hate Christmas. They hate Christmas. So scoot over in your seat. You don't want to sit near them. Golly, we got cameras in here. We got pictures of every single one of you. We're going to put it on the screen next week. No, I'm excited to be with you. I hope you guys enjoyed your Christmas and the holidays and the new year. Today we'll be continuing our study in 2nd Samuel chapter 14 like Billy said. And so if you have your bibles, go ahead and turn there if you haven't yet. And while you do that, I'm going to pray for our time and invite the Lord. Holy Spirit, we welcome you. And God, I know very well that it's you who speaks to us. It's you who brings your word to life. You're the one who leads us into all truth. You're the one who illuminates things who gives us eyes to see and ears to hear. And so Holy Spirit, we welcome you. And Lord, I ask that this wouldn't just be another time where we kind of go through the motions, but God, I ask that we would hear from you. We would come to this place and we would meet with our maker. And so God, would you use your word? Would you use me? Lord, I pray that I would decrease, that you would increase, that the flesh would be no part of this. But Lord, that your word would reign and God, that your spirit would speak and God, maybe it's not even something I have to say, but Lord, maybe you're just going to deposit a thought in somebody's heart today as they're sitting in your house. So God, we're open. We just submit our hearts to you right now and we're thankful. We're thankful that you're a God that still speaks. You speak through your word and God, we want to hear your voice. And so Holy Spirit, we welcome you. We thank you for this time and we pray this in the name of Jesus, amen. The title of this message is collateral damage. Before we dive in, I need to recap a bit for you. You might be new. This might be like your New Year's resolution. You're like, let me come check out this church's cavalry chapel on Broad Street. And so if you're here, you probably aren't familiar with where we're at on our passage. And really, the truth is after Christmas, everything's kind of a blur. Maybe you've forgotten some of the stuff that's happened in 2 Samuel chapter 13, 12, some of the things that have happened recently. And so in order to rightly divide the word, we need to have context. And so I want to give you a little bit of context exactly where we're at. Within the last few chapters, we've seen David fail miserably. You may be familiar with the story. David takes for himself another man's wife. He impregnates her and then he successfully plots the murder of her husband. This is by far the greatest failure of David's life. And from this moment on, David and his family would never be the same. This failure would haunt him for the remainder of his life. And though he would ultimately be forgiven by God, the consequences of his sin would be significant. It was Nathan the prophet himself who made this clear to David. He essentially said to him, the Lord has forgiven you. However, you will pay a dear price for your sin. The consequence of his sin was that from this day forward adversity and disaster would rise from his household. His household was going to be sh- it was going to be shambles. And this has already started to take place. Last week we saw a tragic event occur between David's oldest son, Amnon, and his half-sister, David's daughter, Tamar. In summary, Amnon, David's son raped his own sister and after this took place, she fled and found refuge with her brother, Absalom, another one of David's sons. As you can imagine, Absalom was filled with rage after waiting two years and seeing David passively do nothing, did nothing over what Amnon did with his daughter, Tamar. He absolutely did nothing. Absalom decides to take matters into his own hands. Absalom, he devises "
13,502f7d9af91db6fa,10511,53652,en,whisper_local,base,v1.0,2026-02-18 03:10:07,longest,"Hey thanks for checking out the teaching from Calvary Chapel Chad and Nuga. To learn more about us you could go to our website CalvaryChat.com or you could take us wherever you go by downloading our free app. There you'll find teachings, how to get involved in what God is doing here, and you can even support the work that He is doing through Secure Online Give Me. In the meantime, grab your Bible and enjoy the teaching. Alright, so some years ago, thank you, we're ready to go. Yeah, I'm not the leader by the way, I'm brand new, I'm new here so I don't know what I'm doing. It's just never done this before. Yeah, some years ago, it's about four or five years ago, I think I remember the context, but it was it was just impressed upon my heart. I guess as a pastor who realized this as I looked out, the only one who knows what's coming this year in your life of my life is God. And I was sort of hit with this fresh again. Last Sunday as young Jesse was preaching, I was doing a funeral for just one of my dear, dear friends and one of my few fans and when you've got a few fans, you don't like to seem leave, right? You know, they're going off to heaven. A real, a precious 84-year-old Janice Boydston and this was her service and she would get up at the end of every service and she'd pop her head in and she'd give me a grade. She was a lifetime educator. She'd let me know how I did at the end of the message and I'll miss that forever. I was away with my family right after Christmas and I got a text from her son, Mama's home, she's, I'm like, we just spoke before I left. Sitting in her wheelchair, if she told me once, she told me a hundred times, pastor Frank, I don't know why the Lord just doesn't hurry up and take me home. I don't know how he gets he did, you know. She's sitting there, they found her and she was, she was home. And it just kind of, it just once again reiterates the fact that this thing that we, this life that we live is this is the frail, this is the, this is the place where bodies break down, this is the place where marriages can fall apart, this is the place where our dreams can be shattered. This is where it goes, this is where, thank God it's the short leg of the race, right? Thank God that this is the short leg of the race and what's ahead as eternal. But if, if you wouldn't mind, just sort of, and we've done this for the last, I think four years, this might be our fifth year. Just a show of sort of outward public humble, you know, submission to God. We might start the service with our hands in the air, just sort of as an act of surrender saying, I don't know what's coming, God, I have no idea what's coming and I know that this life could, it can just be a phone call and our entire year can start not the way we wanted it to start, right? We can be gripped with, we can be taken, we're on a mountain top right now, we can be in the darkest valley tomorrow. So I just felt led to start the service as it's been my habit first time in the the new year with our hands up in the air. Now if you're Presbyterian and you're like, do I, I'm not, I don't know, I don't know what comes next when you take your hands up. You could just put your hand just so he sees, just maybe in your lap even, even just turn your hand ever so open so that you are never associated with the Pentecostals. But maybe we just start as with a demonstration of like, Lord, I could you just be merciful to me, I'm so frail, you see what's around the corner I don't, prepare me even now for what it is that's coming and maybe even, maybe even, you know, go ahead and navigate some of those things that might otherwise just crush us. So if you feel comfortable with that, let's just start the year that way. Father in heaven, we lift our hands to you just as a symbolic gesture that we are so needy. We are not wise, you alone are wise. We're weak at the strongest of us compared to you are profoundly frail. You're a rock. We're nothing like that like sand we can shift and change. You never change. We don't see what's coming. We have no idea what's coming. And on the one hand that that can be a bit unsettling. And we don't, we're not called to live in fear but in faith. So we just pause right now with our hands up to you Almighty God, omniscient God, omnipotent God and ask that you'd be merciful with our frail, frail frame and our nature continue to be patient with us. Can and pour out mercy and grace upon us and will give you all the glory for a great year. We bless you, we trust you, speak to us now, your sons and daughters and all God's people say, amen, amen. Okay, so here we are. If you're joining us for the first time, we are glad that you're here with us. You're jumping into sort of the tail end of an epic saga. We've been studying essentially Israel's history in the old covenant or in the old, the original text. First and second Samuel or one book. We have broken it up into two. We did a series through first Samuel titled One Nation Under God an"
32,069adbc6ddf560b6,9890,52311,en,whisper_local,base,v1.0,2026-02-18 03:49:18,longest,"All right. Good morning. Good morning. Oh yeah, you guys lose. I can already tell you that second service on a bad day is going to beat you. And third service, I don't know lightly. That's Paul and Chad got it right. It's right right down the alley. Can you beat this for? All right. Well, Leviticus chapter 11. Let's go there. One quick announcement. And I want to just be somewhat brief about it. Actually, I'll talk about that in just a second. Let me just get past the announcement regarding the women's event or the women's study. That is tomorrow, ladies. It is not too late to sign up for that. We think that this is going to be a really good, really good study going through a really good subject. That's first and second Peter. You don't want to miss out on it. We've got a lot of studies lined up this time around. And Karen Johnson, I was just talking to her about this the other day. She's very excited about teaching through it. I think that it's just been one of those passages that has sort of encouraged her a lot. I know when I was teaching through first and second Peter, it was phenomenal. I mean, it's such a great passage in the Bible to go through. And I for one just absolutely love anything that's going to talk about end times. And you're going to spend any amount of time in that. You're going to spend a lot of time in it, especially when you get to second Peter. And it's very, very, very, very worthwhile. So, okay. So please sign up. If you signed up previously for the previous study, you're going to need to sign up again this time around. So I just thought it would be good to let you guys know. And then also, there's a lot of questions coming my way right now, especially about what is going to happen in Iran. And a lot of the talk about what's happening, especially with some of the recent movements, taking place in the Middle East and some of the policy statements being made, especially by, especially with the statement that the president just made pretty, pretty, pretty aggressive. Just be on the lookout this week. We're going to spend a lot of time analyzing that. There's a lot to talk about. And there's a lot on the horizon dealing with this. There's a lot of discussion happening back and forth. And so we're going to put in some real analysis into it this week for those of you guys that might be interested. This is going to be an interesting time for the people of Israel, especially if things happen the way I think they might. I keep telling David, I'm like, David, take, get back from Israel. You know, I mean, I know he lives there part of the time, but it's going to be an interesting time to see what happens to say the least. And we're going to provide some coverage regarding that and talk about the biblical precedent for it. I'll tell you this one thing. Okay. Anytime war breaks out anywhere in the Middle East, don't listen to the guys that says this is Ezekiel 38. Okay. It's a knot. You got to understand that. In order for Ezekiel 38 to even happen, you have to be in a condition of peace. There has to be peace all throughout to the point where Israel feels so confident about the peace that they have that they in essence remove their security around many of their cities. And that we're not we're absolutely not there. Okay. We're just not. So could that happen quickly? Certainly it could. But right now we're not there. And I don't I don't want the lies that oftentimes come up regarding what's happening based on people that don't know the whole truth with respect to what the Bible says to dramatically we influence how they interpret or how they see everything. And I think that that's kind of a dangerous sort of a dangerous place to be. So don't listen to a lot of that. That stuff is just generally wrong. Okay. Because the Bible gives us the formula and we have it and it's actually pretty clear. So with that, let's pray. Ask the Lord to go before us and we'll dig right in. Father heaven, we just thank you Lord for your word. We thank you for the opportunity that you've given us to dig deeply in your word Lord to understand and discern and know Lord what it is that you're saying. I just take a moment to pray that the words that I share would be your words Lord and not mine and that father you'd be glorified in and through what is said and what happens Lord. We also just pray God for insight and wisdom and discernment and understanding Lord that we would receive direction. And that we would be edified Lord based on the things that we're reading Lord even in a passage like this. There's so many that might read this and think it doesn't have a lot of value, but it certainly does. And we ask Lord that you would continue to inspire us Lord to understand it and to know exactly Lord what it is that you're communicating. So Lord, we just love you. We thank you Lord. We look to you and we ask these things now in Jesus' name we pray. Amen. Okay. So we've been dealing with a lot so far as we've been going thro"
16,b33f91e7be7d7e59,9767,49531,en,whisper_local,base,v1.0,2026-02-18 03:17:33,longest,"Welcome to E-Media, a manual's very own collection of podcasts. We are so excited to bring you a variety of topics from the fun and lighthearted stuff to even the more serious stuff that will impact together. Our podcasts will be available through video and audio so you can watch us or listen to us anywhere that you are. Now, here's the latest episode from the E-Media podcast. Come on, if you're glad to be in God's house today, find three people around you, give them a high five and tell them God is here, God is here, God is here, come on, tell them God is here, God is here, God is here. And he is, he is, he is where two or three are gathered together in the presence of God. There he is in the midst also. Come on, let's remain standing for the reading of God's Word. Come on, turn with me to Matthew, chapter five. Matthew, sorry, Matthew, chapter six today, starting at verse 19. Let's turn there. Matthew, chapter six, starting at verse 19 and those. Welcome to church today as we have been in a sermon series called The Red Letterway. Have you enjoyed this series so far? As we, okay, four people, let me ask again. Have you enjoyed this series so far? Okay, there we go. There we go. All right, all right, here we go. You almost had a late night last night, right? It's Valentine's weekend. Let's wake up, amen? Too much chocolate last night, right? So we've been focusing in, really in January on a journey with what Jesus said, you know, many times in the scripture where you see the red letter, it's what Jesus said himself. And so we've been on a journey as a church starting in January that's running us really through May, focusing on the five things that Jesus spoke on the most and really diving into the words and letting them transform us and then sending us out to be the church. And so we are on really the third saying we started with what? Being? How to be with God? We just finished up last week. Didn't Pastor Jake do an amazing job last week on forgiveness? Awesome job, Pastor Jake. We talked about forgiving, yes? And then today we dive into the third word that Jesus spoke on really more than anything we're going to talk on. He talked about money and possessions and giving really more than anything in the New Testament. So today we're starting that third word on giving. Somebody say giving. So today we begin a mature adult conversations about money. Can we do that today? A lot of times when we hear that word money or giving or possessions, a lot of times there are preconceived notions that come into our mind of what has been portrayed to us. And I understand when you see the crazy TV preacher at 3 a.m. talking about send me money and I'll send you the miracle spring water. Come on how many have seen that before? Or you send me money and I'll send you to prayer handkerchief and that I've prayed over and you're going to receive healing. No wonder we have this thought or this notion of what we think it is. And so my job the next three weeks or so is to really give us a theological framework on what finances mean. A biblical example of what Jesus said of what finances are to really help us gain an understanding. Because until we gain understanding until we really don't know what it says biblically we will remain in ignorance. Hello somebody. And what we are not informed on we will remain ignorant in. And so what we've got to do is begin to reframe what we think and put it back on what the word says. And hopefully that's why you came today. Is that why you came today? You came because you want the truth of God's word. You did not come for a patty cake, patty cake, baker's man. Treat me as sermon as quick as you can. Roll it and pat it and mark it with an S for a sermon for me. No that's not why you came. You didn't come for three points and a poem did you? How many came for the truth of God's word today? And that is why we are here. And so we're going to look in scripture. So today our journey starts us in Matthew chapter 6 starting at verse 19. I'm going to read this whole section through verse 33 of what Jesus said and let the truth of God's word settle on our hearts today. Are you ready for a journey today? So if you are a guest welcome to your first Sunday at Emmanuel starting at verse 19 it says this. Do not stir up for yourselves treasures on earth where moths and vermin some translations say or rust destroy where thieves break in and steal but store up for yourselves treasures in heaven where moths and vermin do not destroy and where thieves do not break in and steal for where your treasure is there your heart will be also the eye of the lamp of the body the eye is the lamp of your body if your eyes are healthy your whole body will be full of light but if your eyes are unhealthy your whole body will be full of darkness if then the light is within your darkness how great is that darkness? Yes? Verse 24 no one serves two masters either you will hate the one and love the other or you will be devoted to the one "
