transcript_id,video_id,word_count,chars,language,transcript_provider,transcript_model,transcript_version,transcribed_at,sample_group,full_text
4,d88937647010d001,6564,34645,en,whisper_local,base,v1.0,2026-02-18 02:53:18,middle,"I said to you today's relationship to beginning in verse 8 through verse 11, the church at Smyrna, would you read along with me please. To the angel of the church in Smyrna right now Smyrna is modern day, is mere. It's the third most populous city in Turkey. To the angel of the church in Smyrna right, these are the words of him who is the first and the last who died and came to life again. I know your afflictions and your poverty, yet you are rich. I know the slander of those who say they are Jews and are not, but are a synagogue of Satan. Do not be afraid of what you are about to suffer. Now let that sink in for a moment. If the Lord appears to you and say, don't be afraid of what you're about to suffer, I think we'd all probably be afraid. Then he says this, I tell you the devil will put some of you to prison to test you and you will suffer persecution for 10 days. Be faithful even to the point of death and I will give you and this is very personal, I will personally hand you the crown of life. He or she who has an ear, let him hear what the spirit says to the churches. He who overcomes will not be hurt at all by the second death. Father, that's the promise that I want to thank you for the most. The second death has no fear because we won't experience it because we believed you because we put you in your right position in our hard sword. We're saved. Our sins past, present and future are forgiven and we're on our way to heaven. O Lord, from the example of the church at Smurne, let us do it with courage and by the strength of your spirit, move us to be active in sharing our faith. Lord, speak to our hearts. We've come to hear from you today. There's anybody in this final service today, Lord, who doesn't know you because it's so cold, so many are watching online. Lord, if there's any there who aren't yet born again, then knock on the door of their heart and ask them to be yours and add to your family. Nothing could bring you greater joy. We love you. We thank you and we honor you and all of this we pray in Jesus name. Amen. In February of 2015, 21 Egyptian construction workers, regular people, they weren't priests, they weren't evangelists, they weren't clerics, they weren't anything. 21 Egyptian construction workers were taken into captivity by ISIS and they were forced to kneel on a beach in Libya where they filmed their execution. The execution was by beheading. These were ordinary people and all they had to do to save their lives was to recant their faith in Jesus Christ. It's all they had to do. They were optic Christians. Now I know there are people saying, well, you know, the Coptic Orthodox Church, they have all kinds of doctrinal difficulties and it's true. But I think all 21 of those men demonstrated their faith was genuine because they refused to say, I won't believe in Jesus Christ and all they had to do to save their lives. Think of the courage that took. Think of the number of angels that were there present but unseen. Think about the numbers of angels, the myriads of angels looking out over the edge of time and space to applaud their heroism though it cost them everything. They refused to compromise their faith and they became 21st century martyrs. The church at Smyrna is the persecuted church. That's what they represent into the second and third centuries historically. A church where it was dangerous to be a Christian, a church where every day you were faced with danger. The church that we really frankly don't recognize because what we live in the 21st century and the West and San Antonio, Texas and we don't face it kind of persecution. And the natural thought is, would my faith survive? Well, I don't know. You and God, that's between the two of you. But here's what I know. We could be facing persecution, not that kind of severe. You know, one of the things to keep in mind when you hear a Bible study like this one is Acts chapter 17 verse 26 where it says that God puts us where we needed to be at exactly the time we needed to be here in order to find God. That means it's not an accident that we're here. We're here because this is our mission field. This is where God has chosen for us to serve. It also means something else about us. It means we're whims because it's pretty easy to do what we do here, not so in Smyrna. You know, Jesus said the people hated him and they will hate you. Well, I didn't do anything. Well, neither did he. I mean, he did miracles and he saved lives and transformed families. But they hated him. He said they've insulted me and they will insult you. A teacher is above the student. If the teacher suffers so too will the students. Where's students? Where's the disciples of Jesus Christ? So all of this, while it's sort of something that we can look at from a distance and say, boy, that was really tough to be a Christian. With all of my heart, I hope this doesn't sound silly to some of you. But I believe that in our nation right now, we're getting close to a time. We're doi"
2,e49079e5df6d21f8,6603,35151,en,whisper_local,base,v1.0,2026-02-18 02:48:38,middle,"Our study this morning, and this is The Church of Thyatirates by least favorite to teach. If you're only just teaching through the Bible, you can't avoid anything. So Revelation chapter 2, beginning in verse 18, through verse 29, the end of the chapter, would you read along with me please. To the angel that is, you remember to the pastor, the messenger, of The Church of Thyatirate, right. These are the words of the Son of God, whose eyes are like blazing fire and whose feet are like burnished bronze. I know your deeds, your love and faith, your service and perseverance, and that you are now doing more than you did at first. Here it is, nevertheless, I have this against you. You tolerate, if you have a King James, it says, you allow. You tolerate that woman, Jezebel, who calls herself a prophetess. By her teaching, she misleads my servants into sexual immorality and the eating of food sacrifice to idols. I've given her time to repent of her immorality, but she's unwilling, and you want to highlight that word unwilling. So I will cast her on a bed of suffering, and I will make those who committed adultery with her suffer intensely, unless they repent of their ways. I will strike her children dead, then all of the churches will know that I am He who searches hearts and minds, and I will repay each of you according to your deeds. Now I say to the rest of you in Thyatira, to you who do not hold to her teaching, and I'm not learned Satan is so-called deep secrets, and in parenthetically He adds, I will not impose any other burden on you, only hold on to what you have until I come. To Him who overcomes, and does my will to the end, I will give authority over the nations. Now, verse 27 sometimes can be a little confusing, but it just describes the authority that we're going to have over the nations in the millennium. He says, he will rule them with an iron scepter, the overcomer, will rule them with an iron scepter, he will dash them to pieces like pottery, just as I have received authority from my father. I will also give him the morning star. He and I always add she, who has an ear, let him hear what the Spirit says to the churches. Father, you loved us enough to give us hard messages. We're grateful that you love us enough to give us encouraging ones as well. Today, Lord, it's a hard one. Holy Spirit, would you open our hearts? I ask that you remove any unwillingness at all, Lord, that remains in this room. I pray that your Spirit will move us to repentance. No beds of suffering here, Lord. Please, merciful God. And I also pray, Father, if there's anyone in this second service, maybe anybody coming to the next service, if they don't know you, if they're not yet born again, I pray, Lord, that this would be the day that they would surrender their hearts to you. You promise us a blessing, Lord, if we read this book, a greater blessing if we do what this book says. And I pray that that Spirit of obedience will rest upon each and every one of us today, for your glory, oh God, how we love you. Bless this time, the teaching of your Word, and Jesus' name. Amen. When I'm good news and bad news, the good news is, and you can hear the coughing and the sneezing going around. The good news is, only 20 more days of Mount and Seed are. Yay! You think it's said for you with Mount and Seed are trying having a microphone in your face all the time. But there's also bad news. And the bad news is trouble. Oh, we've got trouble. Right here in River City, with the capital T in that rhymes with P, and that stands for pool. Now, those of you who are young, Google it. One of the great musicals of all time. But you see, we live in the River City, don't we? That's what our nickname is. And we've got trouble, but it's not a P trouble. It's the T trouble. And that T is for tolerance. We live in a time where we just value tolerance and getting along with people more than almost anything else at all. You know, live and let live. What's the big deal? If people love each other, well, that's what this particular letter to the church that Thyatira is all about. Pergamum, you'll remember, was a compromised church. Thyatira is a corrupt church. Because of the prophetic implications, chapter 1, verse 3, it's a church that has profound implications for each and every one of us. To the angel of the church in Thyatira, right. Now, this is the longest letter of the seven. I think it's ironic that it is addressed to the smallest church of the seven in the smallest city. Thyatira, unlike Pergamum, was a small and almost inconsequential city when historian labeled it a city that is irrelevant. It was located about 34 miles southeast of Pergamum. It was located on a major Roman road. And developed a reputation for commercial business. It was what we would call today a union city. It was where people worked with their hands and the trades. And you'll see later how that factors into Jesus' letter. It was best known for its production of Die, its mention in the"
101,78db72267e74fa70,6643,34242,en,whisper_local,base,v1.0,2026-02-18 12:53:54,middle,"Father God, we come before you. We thank you for your word. Again, we ask that you would open your word to our hearts of fresh. Lord, as we go through this opportunity for one generation of the church to hand to the next generation of the church, wisdom, understanding everything we need for life and godliness, we might now how to conduct ourselves within the household of God. I pray you'd use this book a first Timothy to transform our walk with you. You draw as close to your Lord, may we sense more of your presence, hear more of your still small voice in our hearts, perhaps Lord in this time, be more effective for what you desire to do through our lives than we've ever been before. So come and minister to your church through your word we pray in Jesus' name. Amen. First Timothy, man, do it one way. Okay. This is one of several prison epistles. Timothy, Titus, second Timothy, Fy, Lehman, all written by Paul while in prison, but also so too Ephesians, Philippians and Colossians. But not only did he write to certain churches, he also wrote to certain individuals. And so first Timothy is one of those early letters that he wrote during his imprisonment. And of course some of you are like, what's he doing in prison, how do you get there? So rather than just go through the book of Acts, let me sum up. How's that? So how many of you remember Paul in Acts 21 came to Jerusalem with alms that he had brought to bless the church when he got there James and the other said, hey, there's this sort of word out there on the street about you, you're teaching people of forsake Moses to turn away from basically the law of God and all that. And other were just sort of turning away from the Old Testament. And what are we going to do? So we've got these guys who made a vow, do us a favor, go with them, pay their expenses for their sacrifices. Be with them as they sanctify themselves, come to the end of the vow and everybody will know that this is untrue, that was said about you. And so doesn't tell us well that Paul thought it was a great thing, he did it. And there are almost the any pity, almost there. And some Jews, some Asia Minor, otherwise known to you and I as Turkey, claimed that Paul brought trophamous past that dividing wall from the court of the Gentiles into the court of the Jews only and to do that is a death penalty. And so they raised this riot saying he's brought a Gentile past the burial wall and it tells you in the book of Acts is they were going about to kill Paul. So they're just beating us not out of them, licensed the commander up in the fortress Antonia, seized the problem, comes running in, breaks the whole thing up, grabs Paul, brings him in, they're about to basically beat him and scourge him and he says, hey man, I'm a Roman. And so they bring him the next day in front of the sand, Hendren, Paul makes one statement, the whole thing erupts into a giant argument, they bring him back that night to the prison and word gets out that there's an assassination hit team that is going to make sure Paul's killed dead. Lices, here's about this. Mill the night sends them out, sends them up the Cessarri Amirotima there, the governor has his home. Paul gets there to meet Felix who's in charge at the time and Felix reading what's going on says we'll keep you here until Lices comes up. Well for about two years he's sitting there in Cessarria by the way this last trip to Israel we got to see the prison they had him and they found it. Yeah they just keep digging but that's in the side first service in here. So they get him there and Felix interesting guy, he steals Drusilla King of Grip the second sister who has dropped dead gorgeous, steals her seduces her away from her husband, makes her his own, Paul preaches the Felix about self-control, God's judgment which freaks him out. Any eventually gets recalled to Rome and Festus takes over, you know him as porquies Festus. How do you forget a name like that? Festus goes down to Jerusalem, see the Jews, take care of his governorship, they complain about Paul, they want him to come down so they can try him there because they want to kill him. Festus talks to Paul about it and says hey listen how about we go down and have this hearing in Jerusalem and Paul says listen buddy modern translation I'm at Cessar's judgment seat you can't deliver me to them as you well know that's it I appeal the Cessar and that's it all records are sealed everything's closed Paul gets put on a boat they head to Rome they get shipwrecked at Malta eventually they get on a boat and he arrives in Rome everybody's still with me. He is given to the captain of the guard and only a short period of time whereas there one the captain of the guard his name is Buris Afernis and he died in 62 which means Paul had to get the Rome by 61 to be in charge of the captain of the guard what does that mean to you? Well he probably then had all his troubles somewhere around like late 58 early 59 spends two years in Cessarria"
80,09586edfb3f6d572,6856,35192,en,whisper_local,base,v1.0,2026-02-18 12:16:29,middle,"Hello and welcome to the Hurr Salad Ground podcast. I'm your host, Lisa Phanima, and I can't wait to dig into God's truth with you today. Let's get grounded. Happy 2026 listeners. We are back. We did take a break after the holidays to regroup, but we are ready to start the second half of season three, and I am so excited. I cannot wait for you to hear what we have planned. And I know we are well into January already, but I think most of us are still kind of in organization and fresh start mode. I know I am, although I'm not nearly on top of things as much as I'd like to be. But at best, I probably would call myself a Type-C personality, which is controlled chaos. Since I've had kids, it's pretty much the best I can do. I'm not sure if anyone else can relate to that or not. But, so to help me and the rest of us kind of get our acts together and maybe to get back on track in the new year, I thought I would invite someone on the podcast who is gifted in this area and has a lot of us, a lot to teach us. And the person I thought of immediately is Hickory Creek's own Alicia Kavanaugh. So, I think many of you may already know Alicia. She's a longtime member of Hickory Creek Church, but she's also the newly appointed Bible Study Coordinator. And that means, what does that mean, Alicia? What does the Bible Study Coordinator at Hickory Creek Church do? Well, I'm still learning, to be honest. But at this point, it's a matter of discerning studies with the other Bible Study leaders, planning when they're going to be, what the schedules are going to look like, who's going to serve in the teaching capacity, who the table leaders will be, who or maybe some coal leaders that could come alongside them. So, it's a lot of administrative organizational type things, right, which is perfect, which is why you're here today. And in fact, I know that you are gifted in this area because when we were talking one time, I think it was after the workout class, you were sitting over by Laura Kertcher, the pastor's wife, and we were chatting about Thanksgiving. And I discovered through conversation that you had a spreadsheet to organize your meal prep for the week. Am I right? You're right. Yeah. And so then I knew you were the girl for the little embarrassing. I thought that was amazing. And so opposite of the way I approach Thanksgiving, that is for sure. So Alicia, you are a mother of five. And I know that you are also a leader over at the Bible Study Fellowship chapter in Orland Park. But can you just tell us a little bit more about yourself, kind of let our listeners know? And even some of the members of our church get to know you a little bit better. Sure. Yeah. So I have been married to Kevin for almost 31 years. Wow. That's incredible. It is. Congratulations. Thank you. Thank you. We met at Illinois Wesleyan University. We met in Dr. Stories Old Testament class. Okay. That's a whole story in and of itself. But that's where we met. We got married in 95. We have five kids. Our oldest is Caitlin. She's a graduate from Moody Bible Institute and she is newly married to her husband Gautham. Then we have a son Colin. He is currently at the Ohio State University Moritz School of Law. So he's getting his law degrees. He's in his second year. Wow. Our third child Cameron, he graduated from Indiana Wesleyan. So different than us. Same initials but different school. And he's an assistant band director at a school in the Muncie, Indiana area. Okay. And then finally we've got two in high school. Coleman's a senior at East and Carson is a sophomore at Lincoln Way East. Yeah. We have that in common because I have a senior daughter and a sophomore daughter. So our kiddos are the same age but different schools. We're at the other Lincoln Way. One of the other Lincoln ways. So you know, that's five kids. Five kids is a lot of kids. So I have to ask you, you know, knowing that this organization skill is something that you have. Is that something you've always had or is that something that was like necessary because you had such a large family? In hindsight, I wouldn't have known this in the moment but in hindsight it's something I've always had. Okay. Yeah, I would say if anything with five kids I had a lighten up a little. Oh really? So tell me more about that. What do you mean when you say that? Why do you have to lighten up? There's just certain things that aren't realistic. You have to let go of certain things and be okay with that. Yeah, that is true. You know, there's going to be clutter some days. There's going to be crumbs on the floor. There's, you know, going to be piles of laundry, maybe wrinkled clothes, you know, just certain things like that that are just going to happen. Yeah. I mean, a lot of you that you actually have to do like three times because it is that and then just wash her for way too long and starts to smell. Exactly. Well, I think that's what I'm so intrigued by because I can't even imagine myself with five kids. It feels "
45,90b329c66e2d13ea,6877,36610,en,whisper_local,base,v1.0,2026-02-18 04:13:24,middle,"of the globalization of the news media, you know, we have opportunities to hear about small things that are happening in other countries, right? And in some cases, big things that are happening in other countries that the news media didn't cover, like what's happening in Iran right now. We can pray for our brothers and sisters in Iran. But all that to say, one of the things that's humorous to me as we hear the news from other countries is how human nature is eerily the same from nation to nation, regardless of cultural differences. So take, for instance, a New Zealand man named Ivan Segaden, right now Ivan, I don't know if he moved in from Russia or whatever, but that was his name, he was in New Zealand. And Ivan didn't like wearing a seatbelt. Now I'm not gonna ask for a show of hands, but I would imagine some of you kind of may fall into that category and you're like, not gonna wear it this time, no matter how much my car screams at me. And so New Zealand, like Alabama, is a click it or ticket kind of place, right? And so over a period of five years, the police gave Ivan 32 tickets for not buckling up. But the tickets didn't work. Ivan refused to buckle up. And finally, Ivan actually got the idea that he thought was smart. His problem was in his mind, I'm spending all this money on tickets. It's really affecting my Starbucks budget and my date night budget, I guess, maybe I don't know if that's what he's thinking. And so what should the solution be? Now if you're thinking to yourself, it sounds like Ivan should wear a seatbelt. Then friend, you are too common-sensical for Ivan. Ivan developed an idea where he would have, and this isn't actually Ivan or his necessarily his idea, this is actually a shirt that foolish people, I'll temper my language, that foolish people would wear, instead of wearing their seatbelt, Ivan just came up with one of these deals that when he got in, he made a fake seatbelt strap, he just kind of throw over his body, and so he quit getting tickets. Now the problem was that it didn't really affect Ivan's driving and his trick worked for a while. He didn't have to pay any more tickets, but that doesn't mean it didn't cost him anything. In fact, tragically, Ivan paid with his life in a head-on collision with a tree, where that fake seatbelt did not prevent him from being thrown forward into the steering column and that the actual seatbelt would have stopped. And so discussing the accident, the coroner described the fake seatbelt. He said, though his car was fitted with seatbelts, an extra belt with a long strap had been knotted above the seatbelt on the driver's side, providing a belt to simply sit over his shoulder. Now while there are a number of lessons that we could learn from Ivan today, here's one that you may not be thinking of, when truly tested in this life, what is fake will fail. When truly tested in this life, what is fake will fail you. Or maybe to put it another way is that truth matters. Truth matters. You will ultimately be held accountable for how you live and for what you believe, how you live and what you believe. Accountability for how you live and what you believe, in fact is woven into creation and you could just add to that by the creator. So over the past few weeks, we have had the opportunity to hear the most important message ever declared from four different witnesses. The good news about Jesus Christ describes what's most important to God concerning our redemption. And then his initiative to restore us to his purposes. And last Sunday, in the book of Acts, we saw the incredible power of the Holy Spirit unleashed into the early church, thus continuing the ministry of Jesus and fulfilling the great commission to take the gospel to Jerusalem, to Judea, and to Alsemaria, and to the ends of the earth. And what we see now being played out in the rest of the New Testament is that where the news about Jesus is embraced, where the news about Jesus is embraced, real life as God intended is restored. But where this news about Jesus is rejected, brokenness continues. Let me say that again, because that's really the starting point for the rest of the New Testament, where the news about Jesus and those four gospel accounts, where that news is embraced real life as God intended is restored. But where this news is rejected, where this news is rejected, then life continues to be broken. The gospel is a fork in the road that has eternal consequences. That's why the New Testament authors go from simply describing the gospel, because you think, I mean, if that's the most important message, then why not just have the book of Acts that talks about how the church started and then maybe revelation and how everything ends and then what's the purpose of the middle? It's because they went from describing the gospel to defending the gospel because of this truth, because what you believe matters, you can sincerely believe lies and it still destroy your life, right? But if you believe "
