transcript_id,video_id,word_count,chars,language,transcript_provider,transcript_model,transcript_version,transcribed_at,sample_group,full_text
41,4e492843c465beef,1308,7254,en,whisper_local,base,v1.0,2026-02-18 04:05:38,shortest,"Welcome to the Curious Faith Podcast. Faith is the absence of questions. It is learning where to take them. In each episode we tackle one honest question and seek a biblical, thoughtful answer. My name is Ryan Johnson and my curious companion for today's episode is Mr. Jonathan Light. Jonathan how you doing? I'm doing well. How are you doing? I'm doing good. I'm doing good. Thank you for joining me in this inaugural episode of the Curious Faith Podcast and I'm excited to venture out. And so Jonathan, let's just get at it. What is today's question? All right. So today's question for the inaugural episode is why start a podcast built entirely around questions? What a great question, Jonathan. Well, you've heard me say it often. If you're a member of a God-pay Baptist church here in Scottsboro, Alabama, I love questions. I love questions wherever I am. And because we all have questions and a lot of times we have questions about things that are spiritual in nature, but we are either afraid to ask them. We don't know who to ask. We don't want to ask where people know that we're thinking that because we're afraid of people thinking that we're doubting. And so I really think a core part of my ministry is really to help people understand that questions aren't a threat to faith, that they're invitations to deeper faith. If you're not asking questions, if you're not curious about what you're reading in scripture, if you're not curious about the Christian life, then you're probably not operating off of an active faith. And so this podcast really just exists to take one honest question for episode and dig deeper and answer it biblically and clearly. I'm not trying to win arguments. We're not trying to gain favor with anybody. We're just trying to get clarity and confidence as we walk on this journey and discipleship. And so that's the goal of podcast. It's just to help you think clearly and believe confidently and follow Jesus faithfully. Awesome. Awesome. So the curious companion, what exactly is that role? Well, it is. That's your role, Jonathan. At least in today's episode and in the future, we may have a couple of curious companions on here. But just to make it clear the nature of the podcast, the curious companion is not a debate opponent. We're not trying to trap skeptics, obviously. It's not scripted fluff. You are the voice of curiosity, right? So whereas I'm curious to hear the questions and to answer the questions, your response is follow-up. You're essentially the voice of the listener of the podcast and you're trying to anticipate the person who asks, you know, but what about this as I answer and then want you to press me, you know, when something needs clarification. So the if you're listening to this podcast, the curious companion represents you. It's the person who's listening and thinking, okay, but I don't get this part. So they're going to do follow-up questions in your honor. But this format is really about like creating clarity. You've heard me say that a couple of times now. And it's one question for episode because we're really not trying to rush through, you know, bullet point answers. We're striving for depth over breadth. If you all, if you do know me, you know that I am typically not concise. And so this podcast is trying to force me into a place to be concise. And so these episodes are going to be about 12 to 20 minutes per episode. And I hope by doing that, we will not only help you see this podcast as accessible, but as something that you can just build into your day and to your routine as podcasts are prone to do. Absolutely. And past around, where are these questions coming from? Well, they are coming from past events that I've done. They are coming from conversations that I've had with people. I'm not sharing details about the people who are asking questions, but it's really just about the question itself. If there's any relevant context, of course, we'll give that. But the goal is just to answer questions that have been asked to me. And the questions that we're going to start with are questions that have been asked during the live services at Agape. We have the QR code on the screen during every service so that people can ask those questions. And the hope is is that we'll start with the questions that people have asked most recently. And then we will get into some of the questions that I've encountered from the past. And so yeah, that's really where the questions are coming from. So the idea, folks, is that we want to kind of make a commitment to you that when you queue up this podcast that you can expect and answer from scripture, you know, you can you can know that we're going to be clear. We're going to be charitable about about where Christians disagree. We're sure multiple viewpoints. If that's what you need to know in terms of the question that's been asked, obviously, I love questions. That means I have to love hard questions, right? Which I got some incredible questions at the m"
76,fff27fa6b5ef676a,2857,14646,en,whisper_local,base,v1.0,2026-02-18 12:09:28,shortest,"Hello and welcome to the her salad ground pot cap. I'm Lisa Vanama, your host and I can't wait to dig into Gads Truth through today. Let's get grounded. Well listeners, I wanted to start today off with a little bit of a confession. It's always good to start a conversation with a confession, huh? Lean in a little closer. It's not that big of a deal. But I have a little bit behind in my podcasting. Typically, I am several weeks out, sometimes months out on topics and recordings and lately because of life and just getting adjusted to the new rhythm here at the podcast. It's been sometimes a week by week thing and the schedule is a little bit tight. But the benefit of that has been that as I have chosen topics, I really have been able to take a step back and look at our world or what we as a collective church are experiencing in this moment and really try to speak into and maybe minister a little bit to that specifically. And I do personally feel like the last several weeks have been a little heavy. I mean, let's be honest, last couple years have been a little heavy but I don't know if about you, but I feel like there's been a lot of noise in this world over the last several weeks. And it's exhausting. It's heavy as believers and lovers of the Lord. I feel like many of us take that very personally. We know that division and conflict and pain and hurting is not anything that the Lord wants for our world. He wants us to be at peace and he wants us to be united in him. And so it grieves him when he sees this world hurting and I think it grieves us when we see this world hurting because we have the Holy Spirit inside of us. And so I was thinking back to a few years ago when I was going through a similar season personally where things just felt really heavy. I was taking life pretty seriously and I was definitely weighed down by a lot of worry and overthinking and stress. So I decided that the remedy for this was to paint my front door blue. That sounds a little bit crazy, right? But it really might not be even a big deal to some of you. But remember a couple episodes ago when I told you that I'm more of a neutral girl. I choose safe things. And so choosing to paint my front door blue felt rebellious to me. It actually just felt fun. And now granted, in all things with my personality, you know, we don't change in overnight. And so of course I stressed over the color and shade of blue for three days. But I didn't let that deter me. I just felt like I needed to add some color to what felt like an endless season of gray skies and really deep reflection. I just needed some levity and somehow painting my front door blue felt like the next right thing. And honestly to this day, that front door makes me smile. It reminds me not to take life so seriously all the time and that sometimes simple joys can make all the difference. And so I wonder if maybe that's a word for you today. Maybe you are a little weighed down by the noise of the world or maybe you've been stuck in a season of your own life that feels especially draining. And you're seeking some sort of levity. You know, maybe you're feeling financial stress or a relationship stress or parenting demands or work deadlines. They can very easily add up and steal our sense of joy and wonder. They can like suck the life out of us, right? I mean, you just need to spend two minutes on social media and you feel that chaos just come right in conflict crisis. You name it. It's right there and it can be disheartening. And so what it looked like maybe for you to take a step away and to have maybe a blue door moment. Sometimes when life takes over and our circumstances can dictate our mood, I think we need to get intentional about joy. And yes, the joy of the Lord is our strength and his eternal presence is our hope. But I also think he gave us creative minds and capable hands that can be used to reveal his glory and even unlock the joy in our everyday lives. I'm not saying that those simple joys should replace him, but I do think they can be used to point us back to him. And so I wonder if maybe that's something you could consider today for yourself. Please don't misunderstand what I'm saying here. I'm not encouraging you to check out. What I'm encouraging you to do is to intentionally lean in to the goodness of God. Because when I look around and see the beauty that he created for his own glory, I believe that he also created it for our enjoyment. The chirping of birds, the colorful rainbow after the storm, the seasons and those rhythms we can always count on. I think of the stillness and even the vastness of the ocean, breathtaking sunsets, the taste of fresh strawberries that all points to the goodness of God. Goodness it, we get to enjoy and even joy more when we remember who it all comes from. It tells us in James that every good and perfect gift comes from God. So maybe instead of feeling like we have to bear the weight of our family on our shoulders or the weight of the worl"
31,fca16f0da36b7c27,3529,18451,en,whisper_local,base,v1.0,2026-02-18 03:46:52,shortest,"Okay, for him and his family. Okay, turn to first Peter, chapter one. All right, well, we already prayed, so we won't have to start with that again. So did you like doing the study? Was it a little bit harder than the one before? No, not too bad. Okay, how about the one before? God provides. A little bit more challenging, a little bit? No, okay, well good. Yes, well this is going to be a very emotional book. I was telling Nicole, I said this is going to be really harder to teach because there's so much talk about persecution and waiting through the persecution. And we don't like to talk about persecution because we don't like persecution. And unfortunately, we're kind of wamps when it comes to persecution because our idea persecution is somebody being mad at us at work, persecution back in Bible days where they were being eaten by lions. It's a little bit of a different situation. So, okay, all right, so coming off of what we started two weeks ago in the introduction, that the theme of this book we talked about, and there's many, many different themes in the book, but they all blend together. We walk through many of them as we did in the intro. So many believers during this time that Peter was talking about the persecution. So many of the believers, Jewish believers, were going back to Judaism. And they were doing this because they were waiting for Jesus to come back. They thought he was going to come back right away. And they were waiting and now it's been so many years and they're just going, you know, I don't know if we want to continue with this. There is so much persecution against Christians. And if they just went back to Judaism, the Romans were tolerating the Jews, but they hated the Christians. So in their mind it was like, well, we are Jews and we did accept Christ, but if we completely went back to Judaism, it'd be safer for us and safer for our children. They just wanted to go back to the way they were raised. And some of the Jews who had accepted Jesus as their Messiah were being persecuted and their faith was being tested daily. So Peter in this book is telling these scattered believers because they had been scattered everywhere. To find joy and strength and to find their security in Christ and to have that eternal future focus. Now I've shared with you before that when Pastor Jeff went to be with the Lord that the only thing that kept me sane during that time of missing him was that oxymoron sort of world I lived in where death is the worst thing you can go through. But it's also the best thing you can go through because, and you know what oxymoron means, it's the same event that brings different emotions. And I would think this is not how I wanted to live my life, but Jeff is living his best life. And I know for a fact he doesn't want to come back to this life, even though I wanted to come back. I would have loved that, but I don't know. And I've talked to so many widows and I go, do you really want your husbands to come back? And I go kind of and it's like, you know, they don't want to. They don't want to hear that. Because every widow wants to hear the year husband wants to come back and be with you. But really the truth is they don't. But these are scattered believers. And they were everywhere. And Peter is, you can see all the names of the places that he talks about in chapter 1, verse 1. And he's calling them to come back and to endure suffering for the sake of Christ. This call is also for us today. This is not just for back then. This is for us today because we have a different type of persecution. But the horrific things that went on in Rome during that time were unbelievable. You got to remember Rome ruled the entire world. Caesar was God. The Christians were told you must reverence Caesar as God and they just wouldn't do it. Persecution was increasing, so was their faith. Rome was a cruel taskmaster. If any of you seen any movies about Rome, Gladiator was one of them, where you can see what they would do. They did those not just to the Gladiators, but they did horrible things to the Christians. Again, Rome would tolerate Jews, but they would not tolerate Christians. Christians were hated and the hatred was growing every single year after Jesus died. There was so much hatred toward the Christians. The Romans believed that the Christians were dangerous. They made everything so much worse than it was. Sounds like Democrats today. They were called irrational. They were considered a cult. Christianity. Christians, like I said, they refused to worship the Roman gods. This was treason or sedition. They were in big trouble for not bending their knee to the Roman gods. Anything that happened in Rome, or they didn't know who started the fires or what went on, they blame the Christians. Plagues, disasters. Anything that happened in a day, they blame the Jews. They told the entire community that Christians were cannibals. They turned communion into something very ugly and something that was li"
99,5d1a7c6feaae7dbf,3645,19573,en,whisper_local,base,v1.0,2026-02-18 12:51:10,shortest,"You just said like it is. You said like it is. You said like it is. You said like it is. Today on Sound Truth with Pastor Malcolm Wilde, Calvary Chapel, Mayor at Island. Where are your wise men? Let them tell you now and let them know what the Lord of hosts has purposed against Egypt. Here God is challenging the wisdom of the world and what they would be declared to do. Of course when it says Pharaoh's wise counsel, give foolish counsel, as you know, in Scripture often Egypt's typified as the world. Pharaoh often typifies kings of the world system and rulers of the world system. Everything in the Bible is perfectly accurate. Prophecy is about Jesus came true and it doesn't stop there. Today Pastor Malcolm will talk to you about what some of the events of the end times will look like. Some have possibly come to pass already and there's a lot of prophecy yet to be fulfilled. But one thing you can be sure of is that all of it will come to pass in time. Nothing in the Bible will fail to be true. The earth isn't forever but your eternity with God when the earth's time is up will never come to an end. Well let's join Pastor Malcolm in Isaiah chapter 17 with today's edition of Sound Truth. Turn to the book of Isaiah chapter 17. I like Isaiah, I like the prophet Isaiah. You know that he spent most of his time in Jerusalem and he was a contemporary with Hosea and Micah. And as we've been pointing out, he was the prophet to the southern kingdom of Judah. We mentioned from time to time the northern kingdom of Israel, he prophesied about the northern kingdom of Israel. But he was the prophet to the southern kingdoms of Judah. And he was ministering to the folks of Judah there during the time when the Assyrians conquered the northern kingdom of Israel. This was a long time before Babylon became a world power. 96 years before Babylon became a world power. And yet Isaiah prophesied that they would be involved or Babylon would be involved in the judgment of Judah. And so he speaks about or prophesied about different nations, different countries, Babylon, Syria, Philistia, and Moab and demand. Moab and Damascus, Ethiopia, Egypt, Edom, Arabia, Jerusalem, Tyre. All these he prophesies about as God gives him the revelation in regard to these things. And so we come to chapter 17 and the prophecy is the burden against Damascus. And there are heavy words, burden means of course the heavy words, the prophecy of heavy words that have come against Damascus. Damascus is the capital of Syria. Now when you read through the book of Isaiah, I have to understand it's not all chronological. This has actually written 30 years before the prior prophecy. And there's sort of bundled themes that he has. And there are in the writings changes of style. That's what's called some people to say that more than one Isaiah. But there's years apart and they were written. And so we read of the burden against Damascus. The whole Damascus will cease from being a city. It will be a ruinous heap. So he's predicting the destruction of Damascus. The cities of a row are forsaken. They will be full flocks which lie down and no one will make them afraid. This means there's going to be a grazing area and there's not going to be any people around. The fortress also will cease from Ephraim. The kingdom from Damascus, the remnant and the remnant of Syria. They will be as the glory of the children of Israel says the Lord of hosts. And so speaking here that this also speaking here of the northern kingdom of Ephraim and they were both destroyed two years later than this. And it shall come to pass that the glory of Jacob will wane and the fatness of his flesh grow lean. It shall be as when the harvest gathers the grain and reaps the heads with his arm. It shall be as he who gathers heads of grain in the valley of Ephraim. Yet gleaming grapes will be left in it like the shaking of a novellif tree. Two or three olives at the top of the upper most bow, four or five and it's most fruitful branches says the Lord God of Israel. So it is basically saying very little left after harvesting. He means by that there'll be very few people left or survived this. In that day a man will look to his makeup and his eyes will have respect for the holy one of Israel. You have to ask the question what will it take for people to turn back to the Lord? I think as you study history of great revivals America has been a land of great religious revivals in the past. And you sort of pray that it might be so in the future or not to distant future we hope. We have much time left. And what will it take though for American people to turn back from the broken systems of this world? And once again turn to the fountain of live in water. You got to wonder whether it's going to be that we will have to suffer some hardship if there's going to be another revival, if there's going to be a... It has to be a change in society, a change in culture where people are sort of looking, start turning and looking to the"
65,1a0397ec38e539f8,3734,19935,en,whisper_local,base,v1.0,2026-02-18 04:44:02,shortest,"Hey everybody, this is Brian Zahn and welcome to the Word of Life Church sermon podcast. I'm glad you're interested in what we have to say as we try to serve the Lord Jesus Christ. And if you would ever be so inclined to help us financially, you can do that at wolc.com. All right, good morning everybody. I'm glad to be in the house of the Lord too. Welcome. Last Sunday, we saw the baptism of Jesus. This is what happened next. The next day Jesus was standing with two of his disciples. And as he watched Jesus walk by, he said, behold the Lamb of God. When the two disciples heard him say this, they followed Jesus. When Jesus turned and saw them following, he said to them, what are you seeking? They said to him, rabbi, which translated means teacher. Where are you staying? He said to them, come and see. They came and saw where he was staying and they remained with him that day. It was about four o'clock in the afternoon. Four o'clock in the afternoon. Now the previous day, John had baptized Jesus and said, behold the Lamb of God who takes away the sin of the world. Jesus is the sacrificial Lamb of God who takes the sin of the world upon himself and carries it down into death. Jesus leaves sin in Hades and raises humanity with himself. The great church father, St. Ambrose, said in the resurrection of Christ, the world arose in him. That's what this icon is about. In the resurrection of Christ, the world arose in him. In the book of Revelation, in the fifth chapter, John wept because no one was worthy to break the seals, to open the scroll, and read God's proclamation of redemption. But then the elder said to John, do not weep, behold the lion. Of the tribe of Judah has conquered and is worthy to open the scroll. When John turned and looked to what the elder was pointing toward, John didn't see a lion. Instead he saw a lamb slaying but standing again at the center of God's throne. Jesus is the lion of Judah because he's in the lineage of David, the lion being the symbol of the tribe of Judah, from which David comes and then the kingly lion. So Jesus is the lion of Judah because he's in the lineage of King David. But Jesus doesn't conquer like David did. How does David conquer? Well, he kills the Philistines and kills a bunch of more Philistines. Some of Malachiites now and then. That's not what Jesus does. Jesus is the lion because he comes from the lineage of Judah. But he conquers not as a lion but as a lamb. He conquers in his incarnation, crucifixion and resurrection. So the sin of the world is not conquered by killing the bad guys. That's what we think. The world is not right. We'll kill the bad guys. The world will be right. Wrong. That'll just keep the world the way it is under a different name. The sin of the world is conquered in the way of the lamb in his incarnation, crucifixion and resurrection. Well, on the day after Jesus' baptism, John the Baptist is standing with two of his disciples. One of them was Andrew. The other one is not clearly identified, but I take it to be the narrator. I take it to be the evangelist, John, who composes this fourth gospel. I'm going to think of it that way. So John the Baptist, having baptized Jesus the previous day, is standing with two of his disciples, Andrew and let's say John. And Jesus is walking by and again, John the Baptist says, behold the Lamb of God. These two disciples, John and Andrew, then begin to follow Jesus. They have originally been disciples of John the Baptist, but with the second time that John the Baptist says, behold the Lamb of God, they begin to follow Jesus quite literally. Walking behind him as Jesus has traveling down the road, they're walking behind him. Eventually Jesus realizes that two men are following him. He turns to them and he says, what are you seeking? Ah, this is significant. What are you seeking? John begins his gospel, you know this. In the beginning was the Word. These are the first words we hear from the Word in the gospel. These are the first words of Jesus in John's gospel. We've been introduced to the Word who was with God, who is God, who took on flesh, who then is baptized by John and begins his ministry. But the first time the logos of God, the Word of God speaks words. He asks these two disciples, what are you seeking? This is the definitive question that the logos presents to all of us. What are you seeking? Here you are. You're in your life. It's happening. You've been given the privilege of existence. It's a mystery. You sort of arrive and you don't quite know what's going on. You've arrived in the middle of something. But then we began to become curious. We began to look what are you seeking? What are you looking for? Success, fortune, fame, happiness, power, what are you seeking? I mean, what do you want? What do you want? How you answer that question in honesty? How you answer that question determines a whole lot about your life. Seek it, you will find. But what are you seeking? What do you really want? What ar"
